{
  "version": 1,
  "lastUpdated": "2026-06-11",
  "mastery": {
    "_description": "Thresholds de transicao entre estados (pontos A, B, C)",
    "learning": {
      "distinctSessionsRequired": 5
    },
    "mastered": {
      "totalCorrectRequired": 8,
      "distinctSessionsRequired": 4
    },
    "weak": {
      "consecutiveWrongTrigger": 1,
      "recoveryDistinctSessions": 2,
      "recoveryCorrectPerSession": 1
    }
  },
  "selectionMix": {
    "weights": {
      "WEAK": 0.30,
      "LEARNING": 0.35,
      "NEW": 0.15,
      "REVIEWING": 0.15,
      "MASTERED": 0.05
    },
    "fallbackOrder": ["WEAK", "LEARNING", "REVIEWING", "NEW", "MASTERED"]
  },
  "antiRepeat": {
    "intraSessionUnique": true,
    "crossSessionCooldown": 2,
    "introduceByDifficulty": true
  },
  "progression": {
    "tiers": [
      { "base": 1, "unlockAt": "start" },
      { "base": 2, "unlockAt": "start" },
      { "base": 3, "unlockWhen": "tierLearned", "minTier": 2, "minMasteryPct": 0.6 },
      { "base": 4, "unlockWhen": "tierLearned", "minTier": 3, "minMasteryPct": 0.5 },
      { "base": 5, "unlockWhen": "tierLearned", "minTier": 4, "minMasteryPct": 0.4 }
    ]
  },
  "strength": {
    "halfLifeDays": 3,
    "wrongDecay": 0.5,
    "weights": {
      "recency": 0.4,
      "accuracy": 0.4,
      "sessions": 0.2
    },
    "targetSessions": 4
  },
  "commutativity": {
    "enabled": true,
    "transferFactor": 0.5
  },
  "sessionDistinctness": {
    "mode": "byCalendarDay"
  },
  "session": {
    "questionsPerChallenge": 5,
    "blockSize": 5,
    "maxWeakPerSession": 8
  }
}
